0,1
Is very good,5
got phone and didn't work! wasn't even cleaned as i was pulling lint out plug in port,1
"Broke it, ran slow. Did what I needed it to do when I had it though. Lost my first one, so I got this.",4
The phone got very hot when charging. I'm requesting a full refund and a return shipping label. I do not expect to pay for return cost.,2
Yes it did,4
the phone does not work!!,1
I thought it was the S4 and it wasn't. My wife wanted the s so she's not happy it was a replacement.,1
"its all right , the only problem with it is just like all iPhones is : the home button will partially stop working.",3
Wifi did not work. Speaker mode did not work. Got to get a new one two months later. What a waist of money.,2
"the product was Ok, but 'm not happy with the dealer, my stuffs was late 15 days and I had some problems to get it.",3
Was pretty please with this. It was brand new out of the box. I wasn't aware this was a GSM iPhone. Oh well. I mainly bought this to use as an iPod.,4
it was like new came in a box no scratches tht were visible to me me and my hubby both love our phones they work great,5
"This is in great condition, looks brand new and works great. I've tried to acquire another one at this price.",5
"SInce this iphone 4 ,I have bougt 4,4s,5.But I think this generation is the most classic phone .Just as Jobs said ,it redesign cellphone",5
i bought 2 of these. the phone was shown as unlocked. but it came as locked phone. the phone had scratches and one of them was poorly maintained.,1
it is very good and so far I do not see much problem. it is easy to use. The battery is good.,5
I ordered two phones and one of the phones did not have an external sim port. Now i cannot return the phone which makes me feel sad.,1
"I received my 'New' IPhone sealed in the box, contained everything you would expect in the box and works perfect! Great price for a very good phone.",5
The best phone I have ever had. iPhone the way to the future. I would recommend an iPhone to my friends,5
The iphone 4 was unlocked is a problem for me I had to take and spend more than they should excuse my English,2
It did not come with a sim card and I had to go to a AT&T store to obtain one!,3
The iPhone 4 was everything I thought it would be and more. It was actually an iPhone 4s and it was in absolute mint condition.,5
"A light scratch on the back cover of the phone, otherwise I would have given all 5 stars. Rest looks almost new.",4
It works like new and It even looks like it is brand new. I will shop here again real soon!,5
This phone allow you to do anything you want to do. It's a mini computer in itself. Love my iPhone,4
"Phone works great! Like a new phone, only thing is my front camera stopped working which sucks but it works just fine!",4
"The phone looks pretty good, it works properly, I love it and I would probably get another one, I am very satisfied",4
Love it. It works like a charm. This product is highly recommended for anybody that is interested in it. Will buy again.,5
I can not unlock the cell. It was my fault. But none can unlock it. It was a very bad busyness.,1
Unfortunately I had to return it because it was defective. Very disappointed!This is the first time I receive an item in poor condition.,1
Bought this with Fulfilled by Amazon. We are happy. We are one month into ownership. It functions perfectly. It is used by a construction worker.,5
It's OK. THe surface is very new. The speed and the baterry is Ok. I could not get its charge,4
I really like the phone it is very easy to use and can be cusstomized to anyone with tons of aps avilable.,5
The volume of the incoming phone calls is too low. I need to use speaker to listen clearly to conversations.,3
"Great price, great service! Ships quickly and as promised. Recommend highly. Excellent!",5
was easy to transfer all info from old phone. works great. meets my needs...,4
Good phone,5
the phone was defective,2
wonderful,5
Received the phone inTack but the home key sticks.,2
"THE ELECTION HAS BEEN GOOD, THE SELLER HAS GIVEN GOOD INFORMATION, THE PHONE IS WHAT I EXPECTED, GOOD PRODUCT",4
Received the phone today and it looks brand new so far so good it is in good working order.,5
i love this,4
Did not work with sim card,1
I really appreciated the customer service I received from them. It was immediate and everything is now working. I am really enjoying my phone,5
Brand new looking and all things working properly,5
Looks and works great except for the fact that it won't work as a phone but like a iPod instead,2
as described,5
"Phone works good. I bought used, it was scratched but oh well",3
Great phone is there any warranty service let me know ty,5
Best buy.,5
"Was just as I was hoping for. Good one to learn on. Thanks,",5
the phone wasn't unlocked,3
this phone is rebuilt. not is new,1
Just as described. Works great.,4
Graet phone!! Excelent,3
I bought this and 2 weeks latter it wont turn on.,1
The phone is nice itself but it just don't stay hook to wifi it unhook itself 3 stars for the phone itself,3
It wasn't as described. One of the speakers is blown.,4
The iphone came like in a week and a half and the screen came cracked and the iphone doesnt even work it stays on the apple,1
It was a great phone I expected worse but came out to be something better. Really glad I made this purchase no regrets here.,5
"well I've been using this iphone for 10days now no issues occured on my phone, I did managed to get it factory ulnocked ^_^",5
Loved it like new . Phone came in factory box with brand new head phones and charger. I would definitely purchase another. No scratches,5
"The person who sold it to was very polite and reputable, with everything that they said about the iPhone 4. Would buy from them again.",5
This phone didn't work. It did not provide service when I inserted my SIM card. I took it to the AT&T store and everything.,1
The power button is sticky and it is slow. the touch screen takes multiple hits to get one app open.,3
"this IPhone4 is very good,just like brand new.with a proper price,and I believe the quality of warehouse deals.hope next coorperation.",5
"item described in like new conditionit was in better shape than my other iphone of the same modelwow, great sale",5
"Llego antes de lo esperado el celular, muchas gracias.Recomiendo a este vendedor. . . . . . . .",5
Just the home button does not work great. You have to push it kinda hard for it to work. Everything else works great though.,4
perfect! It arrived quickly and was exactly like the ad listed it. It works perfectly and I couldnt be more happy with it. Thank you,5
"este producto representa Precios competitivos, servicios de alta calidad, gran reputación, y esta en buenas condiciones que es lo mas importante.",4
Home button barely works fresh out of the box. Falsely advertised as new,1
"excelente, gracias",5
not good bad condition.,1
Order two and they died within a month And both had speaker problems,2
It's better to text on than what I had,4
GREAT BUY!!,5
Good phone that state at real with aps,4
Worked pretty well for a while but then started to slow down....,4
"Good condition and love it, I recomend, Not the best deal $300 but its fair.I don't want any contract and new is too expensive",4
I received this iphone yesterday but I can not use it..the home botton is not working...the seller said it was working perfect and tha is not true..,1
I got it today.everything works great but when I make a call receiver can not hear me.Don't buy I would return it back as soon as possible !!!,1
Excellent !!!!,5
The item was in fair condition. It showed signed was not the worst I saw but it showed signs of hard use. The price is reasonable though.,3
This refurbished phone was a piece of junk. Had to use speaker to talk to people and the home button didn't work.,1
"item that arrived did not match discription fully. Was supposed to be a black phone, but back case was white. Phone did not work properly.",2
Phone did have a few scuffs on the screen and on the back but phone works fine.,4
Bought for a teenage daughter who is extremely happy with it.,5
it is a nice teleohone！when i uesed chinamobile sim card ，i found the iphone is unlocked。what a surprise！i really love it！,5
Only problem is the home button and a few minor scratches but other than that the phone works perfectly fine!,4
I PURCHASED THIS ITEM FOR MY HUSBAND AND EVER SINCE IT HAS NOT LEFT HIS FINGERS.LOVE IT NO PROBLEMS AT ALL.,5
iphone 4 is a great pjone . these reviews are what are stupid. you cant just give a rating and go on. NO that have to make it painful.,4
"Don't buy this product. They will put an iphone 3 in an iphone 4 box, and hope that you are too stupid to notice.",1
I like iPhone 4 but at the time was looking for a 4s the iPhone 4g was in great shape...,4
it was in awesome condition it is working perfectly there is nothing wrong. it is an awesome phone i love it,5
"Just what I expected ,not the cheapest but need some thing quick to take over seas as a gift,good condition",5
Seems to be perfect. I am satisfied with the purchase and seems to be in great cond. when shipped. A ok so far,4
I'm still using the product today after losing my original and I was impressed by the details I got for the item which was all accurate,5
The phone came just as he listed it to be. It is in perfect condition and is a great phone.,5
"some of those refurbish phone have being open to the guts, and some pieces replaced with different kind of chinese brands.",5
I like my new phone it's just Some things about it i will have to get use to. Like my connection,3
The phone sounds like I am talking in a tunnel. Nobody can ever hear me on the other line. Not to happy with this purchase.,2
this is my best bye of the year it is a brand new phone,5
Came as described! Brand new and great,5
excelente...,5
super!!,5
👌,4
Arrived in new condition. Excellent!!,5
IT BROKE TH 3RD DAY - HE POSTED IT AS NEW. IT WAS 4 YEARS OLD,1
Love it.shipped on time . Was exactly as described.i have strait talk and this phone dose work with it. You will need to get a SIM card.,5
"I am happy with this phone.It does everything I wanted it to do,Very happy with my purchase.Thank you.",5
i like the device very much it works very well i use it everyday at work and all the time at home,5
"The phone was in excellent condition just as stated..works wonderful..I'd recommend the iPhone 4 to anyway, it's great, love all I can do",5
"I LOVE MY IPHONE IT WORKS GREATE AND I'M GETTING A NOTHER ONE IN 30 DAYS, FOR MY FRIEND KIM",5
Not a new phone. We ordered a new phone. We received a used phone. Per Apple the phone was previously registered.,1
i love the phone it is grate thank u so much i am happy that i got it an it was on time i do recommend it,5
Sometimes Says No Sim When The Sim Is In The Slot & Is Inserted In The Phone . Phone Also Works Slow But Other Then That In Good Condition,3
Sold the wrong color phone and was not an att phone like ordered. Had it two months and cant use it or unlock it. Very unhappy.,1
"This was in great shape and just as it was described. Started right up, able to use the new operating system too! Got one for both kids!",5
"The iphone is in great conditions as it was told on the details, thank you very happy with my order =]",5
"I really like the phone, Thanks It came nicely with bubble wrap so it would not bounce around, again Thanks",5
"I absolutely love the phone, the only problem I have is that when I call someone or receive a call the person on the other end can not hear me.",2
Shipped and arrived on time....Item was just like new and as advertised. Getting the 32GB is worth it if you like having movies on your phone.,5
excelente buenas condiciones el telefono muy eficiente garantizado o o o o o o o o o o o ok,5
"Phone works great! Delivery was quick, getting it unlocked and switched was a pain, but otherwise! Glad I finally have a Smart phone....",4
"the device shap looked good but i have problem with the home key... it was bad, otherwise it was good",1
Could have been better charger cord had a short in it FaceTime needs wifi and no finger print scanner and it should have been 4g,2
Bargain item and works well,5
Great cellphone. Good seller.,5
Wouldn't even charge when I plugged my charger into the charging port.,1
Good phone,3
everything as expected. great product,4
Good product,5
Great!,5
Sound doesn't work,1
excellent,5
The phone I purchased had a problem with the home button. I was able to return it and got all my money back,2
Just what I thought. It's kinda old but looks brand new. Got it for a pretty good price. I will be back,5
"it was a good buy. It was not unlocked so I had to pay for a factory unlock, but it was a good buy",4
"If you're in the market for an iPhone, you probably have made up your mind, and this is as good as they always are.",5
Sorry for the delay to feedback you....I was traveling...I really really like the product...It`s exactly how it was described....Thank you so much....,5
"its everything that was described to be, I love it! AAA+++++ thank you!!!! this is a honest and fair dealer, just as described!",5
The phone is reliable it works a lilttle slow and the home button has to be pressed hard but after that it is a good product,3
This iPhone 4 works great. It came in a box that appeared to be new. The iPhone 4 is not the newest but in my case it gets the job done.,4
"Buy this cellphone as a gift for my wife, I like it because it is small and easy to use for her. The system uses the cellphone iphone is very stable.",5
"Brand-new, as advertised (not a reconditioned). Packaging was a little sloppy (taping failure), but all made it to me in good condition.",5
Great and new.,4
"Good phone, has trouble with home and lock buttons occasionally.",3
Phone is a piece of work. Constantly goes out when talking on phone. I can hear other party but they can't hear me. Not happy ):,4
it was nice until it broke!! i called only to found out many people have called for the exact same phone for the exact same problem,1
the phone was in better shape than I could see in the picture I am very pleased with it.,5
"First of all wasn't even AT&T, freezes and glitches a lot, doesn't even run on IOS 8, I mean it does it's job but not satisfied",2
Works as it should!,5
👍,5
Very good!,5
"not a great phone this is only phone without any acessoires , lock button not working , send me my paymant",1
cool,5
Thank you,5
I AM VERY GLED FOR THE IPHON 4 I BOUTTHANK YOU VERY MUCHGABRIEL,5
Thank you,5
proximity sensor does not work!,1
did work after three month,4
fast shipping awsome,5
yes it did everything works fine,5
Excellent iphone!,5
The quality of the iPhone I received was almost like new plus it came with its own otter box. It shipped out quickly as well. So I'm very satisfied!!!,5
The condition is just as listed to be like new and it works well. It is much better than my old device which was used for 2 years.,5
"The iphone was in perfect condition, looked new with all attachments no failure, no scratches, everything was perfect .... many thanks",5
Everything I want and more. Does everything I want a phone to do and I almost never use my laptop because it is also my mobile computer.,5
"Bought this as a backup until I got iPhone 5. The phone was in excellent condition, without any scratches. like new.",4
The product is excellent. Works great and makes my life and time spent on the computer and phone a lot easier and shorter.,5
I really love my new phone and the funny part is i use it like every sec. lol thank you for the phone,5
it was a gift,4
Product was just what I expected and arrived on time.,5
As posted,5
Even though it's used it still works like I bought it new. Will probably buy used again,5
It's a great phone but it was to small for my fingers so I had to send it in to Amazon heh.,5
When the phone arrived it was more than I expected. It looked practically brand new! I will be buying my next phone from here,5
Good phone for the money.,4
Phone did not work correctly screen sticks tryed to call to remedy the problem got nothing but a run around.,1
that was very very bad .phone work only for 5 min,1
This was a great deal on the phone. It works great and is exactly how it was described. Thank you so much.,5
"That's good. Big to you thanks! I very much liked to be your client, I will surely use your services again.",5
"That's good. Big to you thanks! I very much liked to be your client, I will surely use your services again.",5
"The piece that I received was not a refurbished as they said, it was a used one. I was not at all satisfied with the product and returned it back.",1
Bought this item for my father and he loves it and has already figured out how to load games on it...lol,4
Son loves it I got it for him as a Christmas gift and he's very happy and the phone is still running strong! Love this thing!,5
I give it 5 stars because its my first i phone 4 ever so all nice features keep it up apple company :),5
Great condition! In apple box with charger cord. There were no scatches too! This is a good option without a new contract as i wait for the i6,5
It's not working well you can hear but they don't so the phone it's not good that's why ahi give one star,1
Good.,4
i was real impressed its just wat we ordered thanks so much,5
"Nice phone, however it was listed on a page that said 32gb. Must have been mistaken?",4
Good shopping,5
"Works great, clean, great condition.",5
5 stars iphone came & looks like new works great,5
"Got good deal for 32gb, but home button did not work. Had to pay to change the button. Overall the phone works. Battery last only a day on standby.",4
It was good product but the accessories are not of good quality.the charger is not of good qualityphone has some issue like sound,3
It is really good condition and looks new. I like it. and I will recommend to my friends. Good one!,4
It worked fine until i took pics with it. The back camera was scratched terribly. I had to pay 30bucks to change that.,3
"Phones were great and strongly recommend this customer. I am looking forward to buy these more ,not sure if there are more in the back stock.",5
"so good!it's just a new iphone.And the Black Friday price is also amazing.It would be better if iphone 5 could be sold, haha",5
Perfect!,5
"I still use it, works great",5
Phone as arrived better condition than description. Happy :),4
thak you,3
Arrived in condition as advertised. I did not have any problems with upgrade. Works and looks great.,5
"defective, had to send back",2
Great purchase! It was as good as new... Screen was immaculate and had no surface scratched. I'm very satisfied with my purchase.,4
It's a great product for a great price. It was in good condition and arrived exactly on the day I expected it to.,3
no comments,3
So far its being doing fine.,4
I believe I bought this used for my son and it was in great working condition.,5
Was worried about buying a used phone. I'm very happy with my purchase. Looks and works great! Definitely recommend it!,5
"I love my new iphone, i arrived on time, nw i got all my apps onit. I can reach family and friend near or far",5
Great phone,4
very happy with the phone it looks great and works well for me this is my first iphone and I will stay with it,5
"Looks like new, in addition to the HOME key is not sensitive. Good, service is also very good.Hope to continue",5
I want to return because is not unlockHow can I do it?Please explain to me.Thank you so much.,1
"It came in the mail at a good condition, was a little disappointed the USB cable and the wall plug wasn't included but overall it is good",4
i bought a new iphone online and the camera has a white shadow on the new phone and every pictures.,2
"The unlocked iphone works great internationally. I purchase it for a 2-yr assignment in Brazil and have to say it worked well, never had an issue.",5
I purchased this with the honesty on the sellar that the phone was unlocked and it was not. It cost me additional $40.00 to get it unlocked.,4
"One of the speakers on the phone doesnt work ,the sound is low",3
The home button sticks bad. You have to push a few times hard to have it respond.,3
Great,5
Thanks it work well,5
I am in love with my new phone no marks looks brand new so far having no problems with it I got it in 1 day and I'm just very excited.,5
"Only works with AT&T, no boostmobile no sim card",1
It's very good,4
It has all the features needed to make you totally dependent on it. Just try loosing one.,5
"Thank you, excellent product.",5
Great customer service.....highly recommend for phone purchases,5
Apple ID was not taken off the phone.,1
"Appearance as described, however damaged keyboard unable to log into WiFi or any of my accounts.",1
Everything is as described.,5
very happy with this phone,5
Better than I expected,5
Thanks I love it.,5
"The phone was in perfect condition, works gr8",5
The phone was not new as stated it was defected when it arrive also car alarm pruchase did not work cause more than the item too send back,1
He meet in a good way am happy about the phone is very good the person that use the phone use it in a good way,1
Fair over all..product work good no problem thank you I would grade you a plus. Of course I would recomended..,3
"Front screen is perfect, Lots of scratches on the back an home botton does NOT work. Other then that phone works well.",3
"I love the phone. It came exactly as described except the home button is sticking. Other than that, great product.",4
excelent,5
great deal,5
good,5
It came on time. It works great.. Thanks,4
Was defective. The keyboard started messing up. I could hold my finger just over the keyboard but not touch it and keys would press on their own.,1
does not stay charged what a waist of money had to go back to my original phone not what I expected,1
Don't work,1
Good quality and good price,5
Love it!!!,5
It worked great!,4
Use it as an ipod and a backup phone. For 80$ it is an awesome deal! Ipods cost 150+ and this does everything an ipod can do and then some.,5
"I tried to use a different sim card, it wouldn't recognize it, I can't use this phone for anything",1
Received a shotty battery with device.,1
I bought it for my mother-in-law and she loves it.,5
"Bought for my great grandsons birthday, excellent condition. Also include a case.",5
completely satisfied,5
The phone was claimed to be new but it was not & it had problems!,3
Was kinda buggy,3
good,3
esuless,1
Nice,5
Just as advertised. Am enjoying the shopping experience and phone,5
This is all I expected ! Works great looks new I got it on time and didnt have to worry about if it was a fake iPhone,5
"bought this for my brother. seems to be completely happy with it. it is an older version, but still serves it's purpose.",5
100 % ok,5
power block for cord quit working 3 days later need to get ahold of them see if it can be replaced,5
"Love it, works great",5
GREAT!!!!,5
Loove my phone have no problems hardly no scratches and it's used. Would buy it again when the price is the same again,5
Didnt work....the seller took it back with no questions...I will buy new next time!,1
"The aid said 16gb, but I got an 8gb? What's up with that.?",1
it's good to use. I like it.,5
Perfect,5
Perfect,5
i bought it for a xmas gift. I think he would have cried if no one was in the room. he was that happy. and loves it still,5
Great job!,5
Absolutely perfect condition,5
"Delivered quick and phone had no issues besides the flash does not work, that wasnt stated in the post.",4
"First iphone I've ever had. Great price, great customer service! Came super fast and I love it!",5
excellent product,5
It was exactly what they said it would be . Thank you!!,5
I bought my phone used as to avoid the 2 year contract and high prices of the major companies. We put the phone on Straight Talk and we are loving it.,5
The phone is great but I can not activate because there is a balance on the account it is linked too. Very frustrating.,1
"The charger is broken. I can only charge my phone through USB, which needs almost 8 hours to get battery full.",3
the home key is not work!!the home key is not work!!the home key is not work!!how can i do?,3
"Phone waa a great purchase, was in great condition no scratches came in an iphone 4 box which was a nice touch.",5
"this product has really good features, its functionality it's awesome, other thing about it that i like it's its graphics its applications.",4
Having a great time using my iPhone! Just made the switch from android to apple and I have no complaints thus far!,4
"I have a positive feedback, I`ve got what I expected, the Iphone is in a good condition and I`m using it with pleasure :)",5
This product arrived quickly and I love it. akjfa al;djf;lka ajlja;dfjkj ajf j lkjdf faldkj flkdj f kldajflk fakdjlfj dkjf,5
"Great product, the phone was in great shape and has had no problems so far. No scratches or anything, looked almost new to me.",5
"I wasn't sure of purchase, but when I received the iPhone I was glad to seethat the phone was as described. I would recommend this seller.",5
I would have thought it was new if the box was sealed. It was a great but and arrived promptly.,5
Could not hear a phone conversation unless i had the ear phones hooked up. Played music ok. Everything else worked fine.,1
My iphone is very nice. I didn't expect that because it is amazing. It works fine. Many people like it.,5
"Very good product as shown in the page for a very good price !! I recommend, and hope you enjoy like me !",5
The back glass was broken but was covered up with a case and if I did not have my old Iphone to trade parts with it would had been bad.,1
It was very nice and it looks like it came with a brand new charger and headphones! Awesome and Thank you!,5
Great condition as promised. I purchased it for my teen. Happy with purchase and function with the exception that the home button sticks sometimes.,4
i love it,5
The worst Apple iPhone I ever had.,1
