0,1
Excellent product works like a dream LOVE IT!,5
Luv it!,5
The iPad works great. No issues at all,5
Exactly what I ordered. Works great!,5
Came fast and was in perfect condition. Works great and has no problems.,5
Good product. Fast delivery.,5
Works fine but there's some kind of blue pixel blob on it.. and the back had a dent in it. Meh.,2
Good as new!,5
The product is good and I'm satisfied but what I don't understand why there's no original Apple box?,4
great condition,4
Great ipad. Its the best ipad that I've owned and it was in excellent condition when I purchased it!! Very happy,5
"Looks and Feels Like New, Came in an Generic Box with original charger and original Lightning cable.",4
Came in time and was to my liking,4
Good quality!! Quick shipping!!,4
i received a beaten ipad what a waste of time,1
Better than I thought. Very Nice!,5
Love it😍,5
"Great condition for being refurbished, same as new. Nice product.",5
Love it !,5
Great as I expected,5
"Until now, just perfect",5
Perfect.,5
Excellent! We couldn't be happier. Great price and works wonderful.,5
The IPad mini 3 was in perfect shape aND works flawlessly. Great way to save money.,5
"Really good, new and cheap,",5
"If U don't have an iPad, U don't have an iPad ;)I recommend getting the 64GB... Once U go Apple U won't go Back",5
"I bought this for my sons 9th birthday, and he really likes it!",5
Delivered as promised,5
It was everything that I wanted! I am very happy with it,5
good,4
"Not even a month old and this ""refurbished"" item stopped working. Crap.",1
"I was happy with the size, but it got hot when plugged in and that concerned me, so I returned it.",2
"exactly as described, very pleased",5
Came fast and was in perfect condition. Works great and has no problems.,5
Good product. Fast delivery.,5
Works fine but there's some kind of blue pixel blob on it.. and the back had a dent in it. Meh.,2
Good as new!,5
The product is good and I'm satisfied but what I don't understand why there's no original Apple box?,4
great condition,4
Great ipad. Its the best ipad that I've owned and it was in excellent condition when I purchased it!! Very happy,5
"Looks and Feels Like New, Came in an Generic Box with original charger and original Lightning cable.",4
Came in time and was to my liking,4
Good quality!! Quick shipping!!,4
i received a beaten ipad what a waste of time,1
Better than I thought. Very Nice!,5
Love it😍,5
The IPad stopped working after a week so I spent $60 to fix it.,1
"its perfect. Like brand new. Hold charge more then a week. Works fast, no heating or anything. Love it and saves so much money. Big thanks!",5
"Great iPad, but did not come with headphones and charger did not work out of the box. Plus there were a few scratches on the screen.",3
Nice.,4
Love it.,5
Excellent product works like a dream LOVE IT!,5
Luv it!,5
The iPad works great. No issues at all,5
Exactly what I ordered. Works great!,5
Awesome product!!,5
"The ipad mini is OK, but the lightning cable is not original",5
I gave this to my sister as a Christmas present and she loved it,5
I am enjoying my refurbished iPad mini. I use it everyday. I have no issues. Don't hesitate to buy refurbished.,5
Wonderful easy to use,5
"I got Ipad, but where is the electric wire? I did not see that.",1
Love love love. No issue at all. My ipad looks new like I just got it from the store,5
Just Amazing!Absolutely in love with my iPad!Great product + I haven't had any trouble with it.,5
Items as described.. fast shipping ..very happy thanks...,5
It's was a awful device I poop better things then the iPad,1
I love my iPad,5
Had to send it back only because my granddaughter already had one. But it was perfect for what she needed. And the price was right.,5
Works great. No complaints,5
"excelent, like new no failure so far, good screen and battery",5
Perfect packet mint condition but when I check the functions it's almost the same like IPad mini 2 and I'm paying 119 dolars more,2
Very pleased.,5
Wife loved the iPad,5
good job,5
"Great speed, nice and small.",4
Quick ship. Great product. Happy,5
Perfect,5
I waited so long for this item now that I received it its damage very disappointed,1
Easy to carry wherever you go.,4
"Great condition for being refurbished, same as new. Nice product.",5
Love it !,5
Great as I expected,5
"Until now, just perfect",5
Perfect.,5
Excellent! We couldn't be happier. Great price and works wonderful.,5
The IPad mini 3 was in perfect shape aND works flawlessly. Great way to save money.,5
"Really good, new and cheap,",5
"If U don't have an iPad, U don't have an iPad ;)I recommend getting the 64GB... Once U go Apple U won't go Back",5
"I bought this for my sons 9th birthday, and he really likes it!",5
Delivered as promised,5
It was everything that I wanted! I am very happy with it,5
good,4
"Not even a month old and this ""refurbished"" item stopped working. Crap.",1
"I was happy with the size, but it got hot when plugged in and that concerned me, so I returned it.",2
"exactly as described, very pleased",5
I loved my old iPad which was the same model. I purchased this one because I needed more storage space and I still love this model.,5
"Love it, cannot tell that it is not new. It immediately updated to ios10 and has been great.",5
Nice!,5
"i just got my ipad mini 3. there was small scratch on the back, but it is totally fine.",5
"Appeared to be as good as new - no scratches, dents, etc. Cable and power adapter also like new.",5
Excellent,5
"It seems slow to me. I have had many IPADs, not a fan of this one.",2
Charger not work,1
yes indeedit was in good shapthanks,4
"Totally awesome iPhone great condition works great, will buy from seller again he was very insightful",5
Works as advertised,5
Ok.,3
It came just as told and I loved it.,5
The phones was broken and couldnt is not able to take pictures,1
the phone never turned on,1
Great buy. Great condition. Battery is brand new and holds for days. Classic phone. A true timeless piece. Everything done right.,5
All the other IPhones are overrated. The 2g works just as well. Basic. Sleek. Cool. Holds just the right amount of information that one needs.,5
Average quality,3
I was looking for it to be bigger,1
"Excellent, fast, delivery.",5
Love it,5
"I love this phone but, somebody stole it",5
Disappointed in the phone,1
Bought as a gift but didn't work and couldn't return because it was pasted the 14 day policy! Lesson learned! 😡,2
Had water damage inside phone,2
Awesome,5
"Slow or no internet, no apps to download. Barely usable",1
good thanks!,5
I REALLY LIKED THE IPHONE IT WAS A PLACE WHERE I COULD LISTEN TO ALL MY MUSIC. BUT TO DOWNLOAD APPS WAS HARD BECAUSE OF THE IOS,3
"Have not been able to have this phone unlocked. AT&T can't do it, verizon can't do it. Seems this was a complete waste of money.",1
i like this new phone i got it is so cool and i am on it all day and every day thank you,5
Fasting Shipping but IPhone is not in great condition like it said( missing volume button and crack near SIM card).,3
The cell phone was not chargeable. I returned it.,2
Goid,5
POSITIVE product...,5
I was nervous buying a phone on here. But its in perfect condition!!! I love it<3,5
Very old didn't like it,1
I chose this rating because I like itThe phone was cheap but useableI recommend this to people with cellphoneUnderstanding.,4
The worst thing I have ever bought it broke in a month and how it broke was it lit on fire when plugged in the charger,1
Phone works great & arrived really fast!,5
This was ok,2
The phone does not work and was a huge waste of money! Shame on you for selling a phone that unusable and for ripping me off.,1
"I chose this rate because item arrived as described, as said used Like new.I would like to recommend it to all my friends.",5
"Phone in great shape, the packaging was great the devilery was very fast and I did not have any problems with the order.",5
It doesn't said that this phone is locked. It would be good if amazon described it to let the customer the understand the product well,3
Great for use as an iPod! Overall I am really satisfied with this product. These words are place holders because it's telling me to add more.,5
I love this phone because is small and is not that heavy. I used it for prepaid with att service.,5
"No sim card came with this cellphone. I can't take pics, make videos, store telephone numbers, etc. Haven't really used it yet.",2
This was bought for my son. He absolutely loves it. Says it is the best phone he ever had. That it was a very good value for the price paid.,5
Excellent,5
Very bad condition I almost can't use it.,1
Works great!,5
"software was all messed up, cannot close open programs running in background. Definetly not worth the dollars.",1
Very nice items and shipped earlier than expected by the seller. Nice item as a gift.,5
lot of scratches,2
Thanks but little did it say updated but I will be jail breaking it,1
Awesome,5
Useless locked and can't be unlocked.never again.,1
Came a little dirty but works fine,4
it wasn't unlocked like it said it was,1
Ok,2
It has a lock on it and I can not use it :( waste of money!!!,1
I get to play games when I get waiting in the store,5
received/thanks,5
Really you get what you pay for not happy with this,1
the home button is not operational,1
Home button doesnt work i want my money back,1
Was a gift replacing one he had,5
It was on time product was in good shape and no issues at all,4
Excellent condition,5
very good,5
dont use as a phone no apps no pics all it can do is look cool call and text and be a ipod THATS IT good i pod tho,3
The damaging telefonolo sold. The phone was a fraud.,1
Geat product.,5
yes it was in good condition and meet all expectations.,4
"When I tried to use this phone and activate it, it didn't let me. The phone screen says it is activating and never finishes...",3
"When you try downloading apps you can't , and you can't EVER update it , you can ONLY call from the phone ITS HORRIBLE !!!",1
"Excellent everything perfect, good new product such as this in which the publication, i recommend it because of its seriousness",5
The phone is as described.it works great.it came with a new charger.fast shipping.we are very pleased with our purchase.thank you,5
Came in pieces. Screen was popped out completely. Total disaster. Do not buy This seller should not be allowed to sell phones.,1
excelente,5
it was great.. love it.. very satisfied costumer definitely will by again form u.. it came on time and great condition,5
Loved it in very good condition,5
Buttons did not work.,1
Bien,3
Excellent item and fast shipping,5
ok,5
"As described perfect item used whited00r firmware works excellent now, thank you.",5
Would have been fine if I could have up dated it.,2
bigger then expected but dont expect it to do a lot then u expected and they may gliche up so be careful,3
the phone was not unlocked and had said that if he was.!,2
It turned out to be a perfect gift for a loved one works well as expected but I had to unlock it.,5
I got iphone it was locked.So I have to unlock it & I have to pay another $40.00.Still phone is in good condition.,2
The phone works regularly but are of poor quality headphones and the charger does not work any accessory works even if phone is so cute,3
My package arrived earlier than indicated. I was able to activate the phone w/o any problems. I am very pleased.,5
"Very pleased. The used iphone came in great condition, and actually better than I expected it would be! Great phone for the value.",5
Sent it back was out dated junk,1
Exactly as advertised,5
Good unlocked,4
wouldnt hold a charge. had to return.,3
Total waste of money unless all you want is phone/text everything is outdated and you can't get newer apps,1
Ok,3
quality good for price,4
Very good,5
biggest mistake still havent gotteb it it sucks,1
"I love it and I thank you so much for this phone, it came jus in time",5
very good,5
Better than I expected. The price is right. Totally a great phone.,5
great,5
very nice now use only caharger bad,5
I love bat inhops its com unlocked beacouse the ather i received its verizon,5
"It's very good condition my nephew very excited when he received the iPhone 3G , it's working very good..",5
back button doesn't work,2
Phone cam locked and in fairly rough shape. I returned it,1
good,4
item as describe,5
I talked about when it would come and he is right. The phone in great condition.,5
I love it,5
Cant get in,1
It did not came with the box it came with the phone phew thanks its perfect for my collection,5
It was everything I expected it to be and arrived before the date amazon had set.,5
Works good,5
The phone does not work and was a huge waste of money! Shame on you for selling a phone that unusable and for ripping me off.,1
"I chose this rate because item arrived as described, as said used Like new.I would like to recommend it to all my friends.",5
"Phone in great shape, the packaging was great the devilery was very fast and I did not have any problems with the order.",5
It doesn't said that this phone is locked. It would be good if amazon described it to let the customer the understand the product well,3
I liked this Iphone because it arrived the way it was described.I had had other phones and to be honest this one is much better because of the price.,5
phone was damaged so bad it could not be used i was blamed for the damage it was not unlocked as promised either i was refused a refund,1
Got it used off of Amazon and it worked great. Easy to use. Loved it.Eventually sold it to by the iPhone 5,5
I get a broken phone with smell of glue in it. I send it back to get money or another phone but I did not get anything. Whaiting for one year...,1
"Did not work, should be unlock take it to about 3 sims card other carriers but none could get it to work overseas.",2
I sad because i lost my money whit this iphone.the moter board its bad and the cost for fixex its $150,1
Unlocked I Phone would not work wirth carrier returned to Buy Mart they received 8/6/12 did'nt receive adjustment to credit card yet 8/23/12,1
Function wise it is OK. But it is a used product. All the previous owner's stuff was there. It took long time to get rid of these things.,2
this was a past order but still works fine :D,5
"very nice, product, fast delivery, i recommended to my friends to buy in your store, thanks",4
"My son loves it, I cant even touch it. LOL",5
Not good at all!,1
good,4
Broke even after a exchange. No recommended.,1
Works Great!!,5
good,3
I love it,4
Good,5
Fine... Thanks,5
Okay,3
very cofortable in your hand and easy to use,5
Good,3
It was a present and it didn't disappoint,4
Loved it wen i used,5
i got iphone 3gs 16 gb unlocked phone it is nice and clean.no doubt at all and its work perfectly...,5
"This Cell Phone only worked 1 Month, unexpectedly did not work any more. Technical service told me, the cell phone was Refubrished.",1
"phone was advertised to be UNLOCKED... and it cost me $25 to get it unlocked. Also, it has a very short battery life.",1
Do not buy this online! Save yourself the hassle and just get it from your local at&t or apple retailer!!!!,1
very gooditem is OKI likevery goodvery goodvery goodvery goodvery goodvery goodvery good,4
its an okay phone due to not having the upgrade option and also does not have flashlight either. other than that its slow due to 3G. thank u.,3
When I was looking at this phone online it was says that this is iPhone 3GS but I received an iPhone 3G which I don't like,2
This ad is a fraud.The iPhone announcement is neither new nor unlocked.This is a used product and locked.Do not buy.,1
"thank you very much,i received the mobile phone today and it is a perfect iphone.no broken parts and no programme problemes.",5
"the phone has not come and say who sent him there was nobody to receive it, but because it had a hotel and there is always someone at reception",1
"the equipment is released please do not publish false information that is all I play it back, that waste of time do not recommend",3
Nice phones and nice company.fine product.fine service by the company .all apple product are great like this product is awesome,5
"Thank you for telling me about the old software, the screen is perfect it doesn't have any crack. I'm satisfated with my cellphone",5
false advertising its a 3g. Why are you taking poeople hard earn money. You should feel shame. I hope you get banned.,1
i bought this phone by mistake but it was good and nice i sold it fo my friend he liked it,3
Hi. Thank you very much for such products. I am very pleased with this purchase :) It is very practical and very efficient. Thank you very much.,4
this was a past order but still works fine :D,5
"very nice, product, fast delivery, i recommended to my friends to buy in your store, thanks",4
"My son loves it, I cant even touch it. LOL",5
Not good at all!,1
good,4
Broke even after a exchange. No recommended.,1
I sad because i lost my money whit this iphone.the moter board its bad and the cost for fixex its $150,1
Unlocked I Phone would not work wirth carrier returned to Buy Mart they received 8/6/12 did'nt receive adjustment to credit card yet 8/23/12,1
Function wise it is OK. But it is a used product. All the previous owner's stuff was there. It took long time to get rid of these things.,2
I liked this Iphone because it arrived the way it was described.I had had other phones and to be honest this one is much better because of the price.,5
phone was damaged so bad it could not be used i was blamed for the damage it was not unlocked as promised either i was refused a refund,1
Got it used off of Amazon and it worked great. Easy to use. Loved it.Eventually sold it to by the iPhone 5,5
I get a broken phone with smell of glue in it. I send it back to get money or another phone but I did not get anything. Whaiting for one year...,1
"Did not work, should be unlock take it to about 3 sims card other carriers but none could get it to work overseas.",2
The phone does not hold a charge at all.I cant take it off the charger or it will die even when it says 100%,1
"This classic iPhone has the old school shape and weight, with plenty of performance. I'm one for simplicity and the classic 3GS is a solid buy.",5
"It performs great. I would recommend it to anyone that wants an iphone, but can't afford the latest one out there.",5
Love it,5
Was the best,5
when i recieved the phone the sim card reader was not working and phone would not get passed activation setup screen,1
"The particular phone I got, Well it exploded after it's first Charge! I'm glad it wasn't on my son at the time. I believe he may have gotten hurt!",1
good,5
I don't like it because I need ios 7 upgrade and it wont let me upgrade to it so now I need to buy another new phone that will take the ios 7 upgrade,1
I paid over $200 for a 16 gb phone and ended up getting an 8 gb.,2
"It's beautiful,no real scratches,no cracks.But I may be sending it back,can't access Amazon account on it,or Facebook😱",5
runs soooooooo smoth,5
"This product is very good, and it is what I like to buy it, and it is a very good deal!",5
The phone works great and arrived quickly. This is a used product and I'm very happy with it. No problems.,5
my iphone is working good but the power button is acting up but everything else is working right thank you for the iphone,4
"works amazing, sooo fast and love IOS7 , its super fast and i love SIRI being on it with the new update.",4
I wouldn't even give it one star. I got this phone for my mother. She loved it but it wouldn't charge so had to send it back!,1
My phone worked when I first got it after trying to update phone went dead now won't turn back on,1
excellent everything arrived on time without inconvenienceI recommend it. thanks for product safety . from venezuela thanksbye bye,5
"I bought it a week ago and was dissatisfied, when I brought It to apple store, they said, this is not original phone!",1
Good,5
Niceee,5
Great,5
The phone would not get service. I purchased 3 phone s on amazon. Only one was not hacked. I will not buy another phone on amazon.,1
Very bad,1
very good,5
I am having problems with the charger hookup. Is difficult to hook the charger,3
iphone was in a vary good condition. there vere no scratches. everything was included as it was discribed. i'm very setisfied with my purchase.,5
Phone did not work it was junk could not get money back called and complained they would not do anything about it,1
"In short I end up spending $92.00 in fixing this specious deal, i will never make such a mistake of buying USED electronics from you again",2
The thing that saved it was the company at least sent instructions on how to fix the screen. Stinks because it was a gift :(,2
when i order this item it says 32gb but when the item is ship it change to 16 gb but the price didn't change..... misleading customers..,3
HI THE IPHONE WAS BROKEN FROM THE BACK NEAR TO THE CHARGE CONTACT ABOUT 1.5 in . IM SO SAD ABOUT THESE BECAUSE I WASN'T LIKE DESCRIBED AT ALL .,1
"I love the product, arrived on time and not have any damage, I am pleased with the product . OK",5
love the phone. I can hear others clear as a bell. Just received my phone this week. The music is you can find is great.,5
"I'm happy with the product you received, thank you very much.",3
not good as new.,1
ives effective service. works as expected and promptly. good for those in love with iPhone . recommended to all give it a trial,5
Great quality product,5
I got this phone for my wife and she loves it.,5
No problems noted!,4
"Great phone as stated, very fast shipping!",4
This phone is in great condition! It looks like it is new!! Beyond what I expected!,5
My daughter loves it. It is great.,5
ok i guess.,3
Very cool phone to have for collection,3
Phone was in great condition. Works wonderfully. Great to have as a backup phone.,5
worked fine till I lost sound had to buy the bottom charging part for 6 bucks good again,2
"The product did not say that was not unlock, and I am very upset since I have to travel international and do not have more time.",2
The product was in good structure. I'm still not use it because in Brazil there is to unlock the current version of software.,4
Screen cracked really quick.,2
Phone worked but it was scratched pretty bad and it was semi open like if it was dropped bad.,1
Poor reception,2
This is a great iPhone for me to use since it is my first iPhone,5
"Great condition, reasonable price and will be buying from them again for my audiobook listening for my classroom! Very impressed!",5
The phone was better than expected!,5
Works great,5
Was exactly what I needed for my daughter :),5
good,5
Great when I bought it. Use it as an iTouch now.,5
Good phone ...,5
Excellent and fast shipping,5
Great deal for the price. The phone has little if any wear and works perfectly.,5
Never really worked wouldn't charge,1
outdated quickly,3
good afternoon I received the phone is locked does not recognize the card without my line is movistar sim trajeta says that is not compatible,3
I am enjoying my new phone. I still have a lot to learn about it. Just bought a new cover for it.,4
I was real nervous about buying an iPhone that was refurbished on-line but I am glad I only paid $100 for this 3G it was a great buy.,4
bien,5
Good,4
good phone,3
was not so recommended,1
thank you,5
"This is a great starter phone ,It came within a week and was in excellent condition My brother will have a blast with it",4
Awesome phone. It was neat and doesnt look like used. Easy to acivate and use. Never had issues with it till date. Highly recommended.,5
"The product was exactly what I expected. Very Pleased. The phone came with all the original packaging and ""how to"" manual",5
i wantto know if this phone is AT&T )) i want to bay it. please understand. thnx thnx thnx thnx thnx,5
"Volume buttons dont work, sim card slot broken charging slot at times not functional, alot of freezing when phone is on and five cracks om the back",1
I'm happy with this phone. I really like the speed delivery of this phone. Finally I have an iPhone I love love using this,4
Wish we had purchased 2 of these instead of just one. It has plenty of room to download several movies and shows for the grandchildren.,5
"We had to go get another batter for it and after battery installation, it never worked very well. Always needed to be plugged in.",2
I lost my 5G so I had to buy this one to replace it. It's almost as good!! I never used the Seri anyway.,4
"I bought this phone for my daughter, great phone even thought it's an older model, it's GREAT, service was also GREAT",5
Phone worked great! Only issue was that it wouldn't charge. Something was bent small repair made and it works like a charm,3
"This is a great product, it worth its price. The phone can do as much as all of the other iPhones out there.",5
wharehouse deals POSDON'T BUYTOTAL JUNKdoesn't hold a charge for more than twenty minutesfront screen unresponsivetotal POS,1
"come early than expected and i got a new product, do not know its a used one and i need to buy 2 more",5
I love it and the price is very good for the iPhone I recomend any body who intrest on it purchase the out any doubt.Manny Depina,5
"The only thing I wish is that AT&T & Apple would work out a data service, because I cannot use my unlimited data on my new iPhone.",4
First of all it wasnt match what its says on website. It was internally broken phone and it wasnt unlock.,1
good afternoon I received the phone is locked does not recognize the card without my line is movistar sim trajeta says that is not compatible,3
Perfect for beginner iPhone user..Thank you very much.,5
Thanks,5
EXCELENTE,5
Works great!!,5
fine,5
It's pretty good for a old cell.,4
No problems. Phone look'd brand new!,5
Amazing and fast...Thank you!!!!!,5
"works amazing, sooo fast and love IOS7 , its super fast and i love SIRI being on it with the new update.",4
