0,1
It works good but it goes slow sometimes but its a very good phone I love it,4
"The battery was old & had been over used because it barely holds a charge. Otherwise, no issues with the phone itself.",4
Phone good just a little slow phone old but it's a great phone temporary right now. thank you for the great deal,4
Phone's speaker little low. Overall very happy with the phone. I would purchase another cell phone from Chubbietech. I am satisfied.,4
the phone was great and in good condition. My Daughter is so happy the be a andriod user now !!!!!!!!!!!!!!!!!!!!!!!!!!!!!!!,5
Phone works great. No problems at all,5
was not in good condition but does work good,1
"as described, fast ship!",5
Perfect in every way.,5
One of the phones have a bad charger port. I want to send it back,2
Just got this phone and it is a great phone. It's easy to use.,5
The phone was great but it had gotten old so it was time for a replacement.it was great while it lasted.,5
This phone came in great condition! Great price and it brings back great memories of owning this phone!,5
Met all of my expectations. I can't complain at all. Great price!,5
"Phone is working on, I was planning to use it for whatsapp anyway. The oh problem, I can't change the idiom",5
excellent product in perfect condition,5
excellent,5
excelente,5
excelente,5
I like these phone I bought it for my mom and she loves it,2
It came with arabian keyboard :(,2
"I love the phone, but one problem and one problem only............once the mic goes that's it. No more mic. But it can take a beating.",3
I love it!,5
Very practical and user-friendly phone. I am very satisfied with it.,5
Sharp and classy phone,5
very good,5
100% gooddd!,5
Shipped quickly and was exactly what I expected!,5
Works wonderful for the price!,4
muy buen producto,5
Excellent,5
A friend mentioned this phone to me and it worth what he said. Thanks a lot my friend.,4
Excelente,5
"Excellent phone for my youngest son, with walk in reasonable options, and quality first",5
Excelente,5
solid phone,5
Good choice,5
"perfect, practical, easy to handle, good resolution, well packed",4
excellent product !!....all right....i recommend....,5
excelente,5
Excelente,5
GRACIAS ME LLEGO EL PROCTO QUE COMPRE Y LLEVO EN EL MOMENTO INDICADO Y EN UN BUEN ENVALAJE LO RECOMIENDO SASTIFACTORIAMENTE..,5
"The keys are a little hard to hit, and I didn't expect a Spanish keyboard. But overall, a very good phone.",4
loved everything about it. also it looks like any other touch phone but is not. which makes it stylish yet classic.,5
This phone in an excellent phone at a great price. I was impressed with the features of this phone and would recommend this to anyone.,5
Love it.,5
"Bought it as a gift for my Mum and she loves it. It is a strong durable phone, has good reception and it functions well.",5
"Incredible! This phone does not have Splaniish Language, I dont understand how can it be a international version, lost money!",1
BAD,1
good,5
The battery died in less than 24/hours....,1
Excellent Product.,5
very well,5
Cannot connect to GSM network,1
"pros.. it works fine, its easy to use, not too heavy.cons .. most of the apps are for android iphone and bb",4
I went through lots of reviews for different phone before buying it. I found this phone pretty good. No problems so far.,5
excelente,5
"I have to say that it is a ok phone. I don't like the keyboard. There is only 5 or 6 language options, no Korean and Chinese.",3
excelente,5
Ver Good!,5
"Do not buy it!. It feels like a pretended toy in your hand. If you want it for your kids, it's ok!.",1
"Excellent phone, for adults recommend. . WhatsApp, Internet , app, radio, keyboard qwerty easy for use. Display big visualiser. Funny",5
I liked,4
Great. Arrived quickly.,5
"Phone works great, you may have to get a sum card adapter to make micro sim cats work.",4
"Ad advertised as unlocked, had to pay $30..00 to have unlocked, phone number does not appear on phone.",3
Exactly what I was expecting.thank you.,5
Got it faster than I expected. Just what I needed for my job thanks a lot,5
exelente,5
phone works great for the price although when we got it by UPS the UPS guy just dropped it between the screen door and our big door,5
"Is a good product That I recomended it has all you will need, it's fast good looking very good,thank you",5
my autistic son is in his glory lol thank you again,5
Perfect,5
Worked OK for awhile now every time I tap the back it shuts off,1
Great phone. My sone has been happy with it. Needed to get an extra micro-SD card for more storage.,5
"Valid for Movilnet in Venezuela, low memory, bad camera, low price, great!!",3
"very good, excellent",5
Cheap and fast,5
very good cell,5
very responsible seller and excellent product,5
MUY BUENO,4
fino fino,5
exelentes equipos en lenguaje criollo son una verdaderas naves,5
Good,5
Its great for the price but I hate how you can not change the lock screen to what you wantAnd just has the default wallpapers for your lockscreen,4
like your ad...love it!,5
the charger did not work. My parents started using the cable directly to the phone,3
good quality phone,5
does not work well with T-Mobile. T-Mobile closes off some towers to non-T-Mobile phones.,2
This is a really great phone. I am visually impaired and have no problem with it. Will be getting another one for my partner.,5
More complicated than I expected. Terrible reception. Too hard for my mom to use. Just frustrates her.,1
No internet,3
phone reception poor with incoming calls,1
The sleek design and easy of use is what makes this phone really good. The large text is a plus,5
My husband loves it!! It is simple to use with large numbers. The simpler the better for him.,5
The only reason I gave it a 3 star is because it is a little hard for a elder person to use.,3
works good for 3G and above. Simple to use. No frills.,5
Sounds like you are under water. It shuts off while you are on call.,2
"everything was great. had a hard time getting the old SIM card to work with it, but Verizon hooked me up",5
"Met expectations, easy to use, gave as gift veto elderly relative. She loves it.",5
I received my product.,5
Good phone for elderly people.,5
Bought for my mom! She loves it!,5
"Not as sensitive as our track phone, but the Jethro is easier to read .",3
"Fast shipping, and accurate description",5
the phone is unable to maintain signal after 2 weeks of usage on the TMobile network. I hope it is a defected product,2
Great phone.,5
"Shortly after return window closed, stopped taking a charge and will not turn on.",1
Stopped working after 2 months. Not happy with this phone.,1
Defective product. I have placed my T-Mobile SIM card in the phone but it will not read it. I do NOT recommend purchasing this phone.,1
"sound quality poor, no speaker phone",2
Great phone!,5
Excelente,5
"this phone met all our expectations, my dad loved it and is enjoying it!",5
Just what we needed for an older relative.,5
It was a gift for my Grandma in South America and she loved it thanks!,5
The speakers are garbage and it only tells time in military time,2
"really surprised by this phone, with fm radio and a flashlight and the SOS feature is nice as well for my mom",5
Nice big numbers everywhere! Simple too!,5
Ordered phone but it would not work with AT&T. Called company and told it was due to lack of towers. Found that odd since my cell is at&t,1
Good,5
Thank you,5
easy to use. My mother is 78 but she can use it very well.,4
"The SIM card from the provider would not work in this phone, so I am returning the phone.",2
simple to use. Does not seem to get tiem updates from AT&T,4
Phone number comes with DAILY SPAM Calls. Really annoying .. The phone is good.,3
"Good phone for my mom, big numbers, however settings are somewhat confusing.",4
Locks accidentally when used. Screen is too small to read text message. NOT easy to use for an elderly person.,1
It's a good phone for emergencies and the numbers are nice and big. Easy to use. Thank You so much,5
but did not work with Iwirless,4
Does not have Cyrillic! That was a surprize,4
We bought the phone for my 92 year old mother who is hearing impaired. She could not hear well on it at all.,2
As arrival of this phone and I couldn't charge it its so frustrating,2
"Looks good, as advertised, instructions not easy to follow. Keys are quite large and fairly easy to see.",4
My Dad loves it - works great with no confusing bells and whistles,5
Very bad same week i bought could not turn on / offNot worth the hassle don't buy it,1
Both of my grandmas love it!!! It could have a bigger screen and more ringtones,4
It's just what we were looking for,5
"Mom doesn't like any kind of change, so it has taken some time and effort to get her to embrace this versus her old flip phone.",5
Stopped working after a month of use.,1
Real nice and simple phone for grandma,5
"This is basic, but has all the features necessary for seniors.",4
returned would not read sim card.,3
"Great phone for elderly or those not familiar w/ cell phones. Numbers are large,...easier to see.",5
not working,1
Loving it,5
I love this simple handset and the limited number of features I can find on it to get myself into trouble.,5
"The SIM card from the provider would not work in this phone, so I am returning the phone.",2
Great phone!,5
Excelente,5
"this phone met all our expectations, my dad loved it and is enjoying it!",5
Just what we needed for an older relative.,5
It was a gift for my Grandma in South America and she loved it thanks!,5
The speakers are garbage and it only tells time in military time,2
the sim card dose not read so what the point selling a tablet /phone that don't work,1
"This item is not worth the money I paid. cant find where to put memory card. screen isn't clear very blurred, this item sucks",1
Good phone,5
When charging the battery the screen had waves of interference to the point I would not use the tablet while charging. I returned the tablet.,2
"I AM IN VENEZUELA, THE BATTERY CHARGER IS DAMAGED AND HERE IN VENEZUELA NO WARRANTY THAT BATTERY CHARGER TABLET",3
"This tablet only worked for 4 months, now it is giving trouble to connect to WiFi so i have no play store access. It sucks",2
"Really nice, my daughter uses this everyday and its almost been a year and its still going strong...she loves it",5
good,4
Thank's for best supply!!!!,5
Very upset The tablet did not work. Sending it back. Will be replacing it.,1
Excellent,5
great phablet for all general uses,5
Is great i love everything about it.,3
"not liked, because the language is in mandarin or HK also I cannot downland any apps from android stores.",2
arrived broken and forgot to send back,1
this phone is not worth the money. the plastic is flimsy and the phone hardly works. I am trying to return mine now. don't waste your money.,1
"Is partial internet working,but Indigi is workin on it,hope will be ok",3
This little phone is great compact and easy to use love it .Michelleheraud,5
This little phone is great compact and easy to use love it .Michelleheraud,5
This little phone is great compact and easy to use love it .Michelleheraud,5
I hate it!!!! I will be sending it back. It keeps blinking on and off. I want my refund back!,1
Lots of nice features but touch response slow. Nice looking phone. I only use the phone for one week and I will write review again. Sound volume poor.,3
"We buy these for work, good price and would be extremely durable for the average person. We do HVAC and we break them a lot not the holster fault.",5
Does the job but just barely,3
lasting longer than the oem,5
Crear product. Fast arrived.,5
Good thing I had order this 3 pack. Poor quality already burned they 2 cases,3
Works great.,4
"Looks just like the original and I believe it is the original, but a whole lot cheaper.",5
these work nice for the price and that is why i bought so many,4
Great,5
Great value for some one who uses the Otterbox Defender.,5
Great buy & service!,5
Work great!,5
not as thick as my old one but it will do!,5
Other than clip breaks easily. It's ok for the price.,4
Fits as advertised.,5
A++++++++,5
Good product and just as described,5
These seem to be the same as the original at a much lower price.,5
"My husband breaks his otter box belt clip about every 5 to 6 months, so it was great to get this pack of 3. It fit perfect with his otter box.",5
Seems to work fine,5
"Look, feel, and fit like the original, but pressed in *China* instead of *Mexico*. No complaints.",5
"Clearly a knock-off. First one snapped after 2 weeks, but for a couple of bucks each, not unexpected.",2
you only got me two belt clip and one not functioner properly.,1
"you can download music, applications, comes unlocked, with accessories, well good for that price.Amazin seller!",5
"Hey those phone won't charge, and what is the insulating film that I have to torn off or on idk before use I don't understand that",1
The phone is not powering on I sent it to Jamaica WI and will return once I receive it back,1
not good,1
"Phone is alright, though it did not come with an SD card which you need if you're going to install a few apps",5
Good for the price.,4
My sim card slide all the way up in the slot. I had to open the phone to retrieve my chip.,4
"Phone memory is very small, so it works erratically. And no is not working anymore, I do not recommend to buy this phone",1
Very good,5
"liked the design and the cost was worth it too,I bought this for a family member and so far no complaints",4
did not work with at&t network,1
Ok phone I buy for someone,4
works short battery life,4
Good tanks,5
"It is a nice phone,I buy it to used when I traveled outside the US,I loved it,good smartphone for the price.",4
"My wife loves it, works great and easy to use.",5
It is an excellent phono with low cost!,5
Excelent.,5
Great as expected,5
I love it very much!,5
muy bueno,5
My mom loved it until the screen cracked 6 months later just by laying in the purse..,5
Horrible horrible phone no reception keeps downloading programs DON'T BUY,1
Good,5
No I didnt I had to by a new phone,1
"Small phone, isn't compatible with most us services but has nice color and amazing storage.",2
"It did not work, nevera on. Too bad.",1
It was really bad literally no memory and 2 pages to put stuff on I would not recommend it unless you just wanna call in and out and take good pics,1
"i mean it works but the screen is horrendous, the viewing angles are absolutely horrible",3
"phone works fine, would have liked more extensive instructions and so far i can't find a protective cover for it",4
Gave the phone as a birthday gift. My friend seems happy with it so far.,5
"I have had the phone for seven days now and I am impressed. Its setup is very simple. The screen quality is great, and the processor is fast.",5
" This is an extremely fast, good-looking phone with excellent storage options, great screen clarity.",5
Not recommended. Won't charge after just a few weeks of use.,1
"No the phone done have Bluetooth on it, which is so bad for my son.",3
its a good phone but barely holds any apps.The space is limited,3
"The phone meet the minimum standard. The network is good but, I can't receive the 3G on my phone to satisfy the desire for purchase",1
"I bought this phone for a gift, and when I recieved it, the phone did not work. I had to pay again to return the cellphone from Venezuela to USA.",1
It did not work.,1
Simple enough with plenty of functions.,4
Excelent,5
Better than I expected.,5
Excellent,5
very bad,1
Good,3
I didn't like this phone. It is a horrible phone,1
very slow i regret buying this i suggest different phones,2
Excellent,5
"I HATE THIS PHONE, WEEK LATER HAD TO BUY ANOTHER ONE...ITS SLOW AND STORAGE IS VERY POOR...A WASTE OF MONEY...NEVER AGAIN...",1
So bad,1
Its good but it's getting heat if I talk more than five minutes,1
Piece of crap,2
bueno,5
excelent thank u,4
Great phone and easy to use. The price is really good for it.,5
"The package arrived on time and in good condition. It not covers all my expectations, but is functional for me.",3
Phone did not come with a sim card and did not work,2
"Not the best phone, but made it work temporary.",2
Good basic smart phone,5
Satisfied with the product. Value for money.,4
Wonderful phone it absolutely met all my expectations..i took it to the West Indies and it worked perfectly,5
Phone doesn't turn on.Battery is dead.Isn't charging at all..,1
phone did not turn on even after charging phones for hours. Hope this is not a joke,1
Excelent...,5
"you can download music, applications, comes unlocked, with accessories, well good for that price.Amazin seller!",5
"Hey those phone won't charge, and what is the insulating film that I have to torn off or on idk before use I don't understand that",1
The phone is not powering on I sent it to Jamaica WI and will return once I receive it back,1
not good,1
"Phone is alright, though it did not come with an SD card which you need if you're going to install a few apps",5
Good for the price.,4
My sim card slide all the way up in the slot. I had to open the phone to retrieve my chip.,4
"Phone memory is very small, so it works erratically. And no is not working anymore, I do not recommend to buy this phone",1
Nice phone my cuzin in Jamaica loves it,3
"My wife loves it, works great and easy to use.",5
It is an excellent phono with low cost!,5
Excelent.,5
Great as expected,5
sucks,1
Works great luv it:)),5
Great Phones Works Perfectly Overseas. Great Buy😍😍😍 love this phone,5
Excellent..!!!! Thanks.,5
Great cheap phone.,5
fine,4
The phone lasted 5 days and went dead never came back on. Will not charge or come on. Horrible phone!,1
excelent,5
love it,5
muy bueno,5
My mom loved it until the screen cracked 6 months later just by laying in the purse..,5
Horrible horrible phone no reception keeps downloading programs DON'T BUY,1
Good,5
No I didnt I had to by a new phone,1
"Small phone, isn't compatible with most us services but has nice color and amazing storage.",2
"It did not work, nevera on. Too bad.",1
Nice color and runs a smooth and stable system. The audio quality of voice is good which beyond my expectations.,5
The screen is simple and very tactile. Easy for me to browse. ,5
Great Phone Fast Delivery,5
It was really bad literally no memory and 2 pages to put stuff on I would not recommend it unless you just wanna call in and out and take good pics,1
"i mean it works but the screen is horrendous, the viewing angles are absolutely horrible",3
"phone works fine, would have liked more extensive instructions and so far i can't find a protective cover for it",4
Gave the phone as a birthday gift. My friend seems happy with it so far.,5
"I have had the phone for seven days now and I am impressed. Its setup is very simple. The screen quality is great, and the processor is fast.",5
" This is an extremely fast, good-looking phone with excellent storage options, great screen clarity.",5
Very good,5
"liked the design and the cost was worth it too,I bought this for a family member and so far no complaints",4
did not work with at&t network,1
Ok phone I buy for someone,4
works short battery life,4
Good tanks,5
"It is a nice phone,I buy it to used when I traveled outside the US,I loved it,good smartphone for the price.",4
100% recomendado,5
The audio does not work!!!,1
Im happy with my new phone! Its very fast,5
"Perfect design, it's a pity cannot use the T-mobile network.",5
"Really nice phone, it's not working in USA 2G-3G-4G",4
very good,5
Bad very bad and not support Google play store,1
It's Ok.,4
I got it with cover plus Adhesive protection film on both sides,5
Excellent phone!,5
good phone with a top hardware and relative low price.,5
"Really nice phone, it's not working in USA 2G-3G-4G",4
very good,5
Bad very bad and not support Google play store,1
It's Ok.,4
I got it with cover plus Adhesive protection film on both sides,5
Excellent phone!,5
good phone with a top hardware and relative low price.,5
So to be put to use by the beneficiary,4
Attractive phone but did not work upon arrival. I would not recommend.,1
Cheap-- I am sending it back..,1
Just received phone... Phone will not power on or take a charge?,1
Battery keeps running down not charging pass 60%,2
volume not loud,3
Didn't work when it arrived! So I returned it! What a waste,1
OK so far,3
"SO FAR I HAVE PHONE ACTIVATED,BUT NOT VERY HAPPY WITH PERFORMANCE,WAITING FOR ANDROID UPGRADE HOPING THAT WILL COMPENSATE ALL THE HEADACHES.",1
No 4g with ATT just 2g,2
camera is not that great...but it's a great introductory smartphone for the price.,4
Cool phone,5
"When phones like this is on the market the competition is on, works great runs smooth and you can't brat the price",5
It's spectacular. This phone hace a good perfomance. I like it so muchos. It's cheaper the another famous celular but it doesn't shy,5
"Good phone, good qualty, the only that can better is the camera, on night..",5
Just received phone... Phone will not power on or take a charge?,1
Battery keeps running down not charging pass 60%,2
volume not loud,3
Didn't work when it arrived! So I returned it! What a waste,1
OK so far,3
So to be put to use by the beneficiary,4
Attractive phone but did not work upon arrival. I would not recommend.,1
Cheap-- I am sending it back..,1
Just received phone... Phone will not power on or take a charge?,1
Battery keeps running down not charging pass 60%,2
volume not loud,3
Didn't work when it arrived! So I returned it! What a waste,1
OK so far,3
It was okay but the screen cracked after having it for 1 day,2
I bought this phone to use on traveling to Africa. It works great. I got a lot of compliments on it. Will buy again.,5
"So far my son thinks it's a great phone,,",5
This phone does not stay charge as well as it just started messing up and i had just ordered it. This is the most issue i ever had out of phone.,1
"I love this phone if I could buy another one, I would definitely buy it.",5
Junk,1
"The screen gets stuck, and goes black sometimes. It is also slow!",3
The item was not working at all,1
Does not work at all. Let the seller checked averting on the phone before shopping it to you.,1
"Lousy phone, speakers didn't work",1
The item was not working at all,1
Does not work at all. Let the seller checked averting on the phone before shopping it to you.,1
"Lousy phone, speakers didn't work",1
The item was not working at all,1
Does not work at all. Let the seller checked averting on the phone before shopping it to you.,1
"Lousy phone, speakers didn't work",1
A few issues but the main one is: Poor signal reception. Looses signal where other phones on same network has signal.,2
Don t like it,1
A few issues but the main one is: Poor signal reception. Looses signal where other phones on same network has signal.,2
Don t like it,1
Junk,1
The item was not working at all,1
Does not work at all. Let the seller checked averting on the phone before shopping it to you.,1
"Lousy phone, speakers didn't work",1
I returned it...don't bother..u can make calls and text but forget about using your carriers internet/data outside of Wi-Fi. Its really cute though.,1
Phone was too slow. Had a defect.,2
This phone arrived dead,1
"I bought this phone "" 5.5""unlocked GSM phone"" and shipped to Africa , but this phone never work...I waisted my money",1
Phone would not turn on after charge all night,1
The phone was just overall horrible,1
worked 2 days and died,1
Phone was too slow. Had a defect.,2
This phone arrived dead,1
"I bought this phone "" 5.5""unlocked GSM phone"" and shipped to Africa , but this phone never work...I waisted my money",1
Phone would not turn on after charge all night,1
The phone was just overall horrible,1
worked 2 days and died,1
This phone arrived dead,1
"I bought this phone "" 5.5""unlocked GSM phone"" and shipped to Africa , but this phone never work...I waisted my money",1
Phone would not turn on after charge all night,1
The phone was just overall horrible,1
worked 2 days and died,1
Phone was too slow. Had a defect.,2
Junk,1
Junk,1
It's very very good,5
good,5
Excellent seller recommend 100%,4
perfect,5
the best phone you can buy for this price I love it,4
exelente,5
excellent product.,5
very good,5
Excellent phone functions recommend,5
I'm so surprise about this phone...great quality! In cheap price!!!!happy happy the only cons is the long wait to be shipped.but its worth!,5
gracias,5
The camara sucks,2
quality team recommend them to everyone on amazon.,5
Very nice.arrived on time. I love it.,5
Excellent!,5
Its lovely ! My brother in law loves it so far.,5
bien,5
This phone is very good.,5
excelente,5
Better than expected,5
Excelente telefono.,5
BUENO,5
good,5
muy bien,5
It is a great phone for very fast and reliable. I'm happy with my phone,5
Good,5
Excellent,5
THANK YOU SO MUCH! ARRIVED IN EXCELLENT CONDITION,5
the phone can be put in Spanish ?,1
Came with only Chinese instructions. Defective and would not charge for many days. Had to return to Amazon.,1
Exelente,5
"I received it, charged the battery and nothing happened. The photo was DOA. Nada. Returned and got my money back to buy another brand.",1
"Genial cell phone, fast and beautiful. The camera is us their main attraction.",5
excelente,5
good quality product and was ordered and arrived in time .,5
"There are a problem, the menu on the PC is in chinese",4
Thank you very much for the excellent product,5
"Serious excellent seller and excellent product, i recommend...",5
😊,4
Very good,5
Bery good products,3
awesome - only photo quality not goo,5
good porq my product does not have tracking,4
very good phone.....u can go for it.....,5
Excelente,5
very good the product.,5
"Love the phone,plays all my apps and for the price its Good",5
Charge port went bad within a few months,3
"sometimes the screen and home button are unresponsive to the touch, maybe i got the defective one, but i do like lenovo brand.",3
